{
  "$schema": "../../../schemas/boldcreate-plugin.schema.json",
  "name": "google-cloud-bigquery",
  "displayName": "Google Cloud BigQuery",
  "version": "0.7.0",
  "description": "Explore datasets and tables and run SQL queries.",
  "author": {
    "name": "Syncfusion"
  },
  "homepage": "https://docs.cloud.google.com/bigquery/docs/use-bigquery-mcp",
  "repository": "https://github.com/syncfusion/BoldCreate-Plugins",
  "license": "MIT",
  "logo": "assets/logo.png",
  "category": "database",
  "keywords": [
    "bigquery",
    "sql",
    "analytics",
    "data warehouse",
    "mcp"
  ],
  "hostedBy": "vendor",
  "stage": "ga",
  "docs": "https://docs.cloud.google.com/bigquery/docs/use-bigquery-mcp",
  "rollout": {
    "phase": 2,
    "wave": "B"
  },
  "supportedByGateway": true,
  "variables": {
    "CLIENT_ID": {
      "title": "Client ID",
      "description": "A Google OAuth client your team created. Every team member signs in under it.",
      "required": true,
      "secret": false
    },
    "CLIENT_SECRET": {
      "title": "Client secret",
      "description": "The secret for that OAuth client. Stored encrypted.",
      "required": true,
      "secret": true
    }
  },
  "components": {
    "mcp": [
      {
        "name": "google-cloud-bigquery",
        "transport": "streamable-http",
        "url": "https://bigquery.googleapis.com/mcp",
        "auth": {
          "type": "oauth",
          "alternatives": [],
          "oauthClient": {
            "clientId": "${CLIENT_ID}",
            "clientSecret": "${CLIENT_SECRET}"
          },
          "scopes": [
            "https://www.googleapis.com/auth/bigquery"
          ]
        }
      }
    ],
    "skills": [],
    "rules": [],
    "hooks": [],
    "agents": [],
    "commands": []
  },
  "endpointCheck": {
    "lastLiveCheck": null,
    "source": "vendor docs (docs.cloud.google.com/mcp/supported-products)"
  }
}
